{
  "$schema": "https://json-schema.org/draft/2020-12/schema",
  "$id": "urn:envarpay:buyer-policy:1",
  "title": "Local buyer permission policy; not supplied by the seller",
  "type": "object",
  "additionalProperties": false,
  "required": [
    "policyVersion",
    "paymentsEnabled",
    "approval",
    "peers",
    "budgets"
  ],
  "properties": {
    "policyVersion": {
      "const": 1
    },
    "paymentsEnabled": {
      "type": "boolean"
    },
    "approval": {
      "enum": [
        "per_purchase",
        "within_preapproved_limits"
      ]
    },
    "peers": {
      "type": "array",
      "minItems": 1,
      "items": {
        "type": "object",
        "additionalProperties": false,
        "required": [
          "id",
          "cardUrl",
          "protocol",
          "currency",
          "recipient",
          "maxPerPurchase"
        ],
        "properties": {
          "id": {
            "type": "string",
            "pattern": "^[a-z][a-z0-9-]{0,63}$"
          },
          "cardUrl": {
            "type": "string",
            "format": "uri",
            "pattern": "^https?://"
          },
          "protocol": {
            "enum": [
              "x402",
              "mpp",
              "free"
            ]
          },
          "currency": {
            "type": [
              "string",
              "null"
            ]
          },
          "recipient": {
            "type": [
              "string",
              "null"
            ]
          },
          "maxPerPurchase": {
            "type": "string",
            "pattern": "^(0|[1-9][0-9]{0,77})$"
          },
          "mode": {
            "enum": [
              "envarpay",
              "standard-a2a"
            ]
          },
          "endpoint": {
            "type": "string",
            "format": "uri",
            "pattern": "^https://"
          },
          "authentication": {
            "enum": [
              "none",
              "bearer"
            ]
          },
          "localContract": {
            "type": "object",
            "additionalProperties": false,
            "required": [
              "revision",
              "offerId",
              "inputSchema",
              "amount",
              "paidOnly"
            ],
            "properties": {
              "revision": {
                "type": "integer",
                "minimum": 1,
                "maximum": 9007199254740991
              },
              "offerId": {
                "type": "string",
                "pattern": "^[a-z][a-z0-9-]{0,63}$"
              },
              "inputSchema": {
                "type": "object"
              },
              "amount": {
                "$ref": "#/$defs/amount"
              },
              "paidOnly": {
                "const": true
              }
            }
          },
          "method": {
            "enum": [
              "stripe",
              "envar"
            ]
          },
          "issuer": {
            "type": "string",
            "format": "uri"
          },
          "environment": {
            "enum": [
              "sandbox",
              "live"
            ]
          }
        },
        "allOf": [
          {
            "if": {
              "properties": {
                "protocol": {
                  "const": "free"
                }
              }
            },
            "then": {
              "properties": {
                "currency": {
                  "const": null
                },
                "recipient": {
                  "const": null
                },
                "maxPerPurchase": {
                  "const": "0"
                }
              }
            },
            "else": {
              "properties": {
                "currency": {
                  "type": "string",
                  "minLength": 1
                },
                "recipient": {
                  "type": "string",
                  "minLength": 1
                },
                "maxPerPurchase": {
                  "$ref": "#/$defs/amount"
                }
              }
            }
          },
          {
            "if": {
              "required": [
                "mode"
              ],
              "properties": {
                "mode": {
                  "const": "standard-a2a"
                }
              }
            },
            "then": {
              "required": [
                "endpoint",
                "authentication",
                "localContract"
              ],
              "properties": {
                "protocol": {
                  "const": "x402"
                },
                "endpoint": {},
                "authentication": {},
                "localContract": {}
              }
            },
            "else": {
              "not": {
                "anyOf": [
                  {
                    "required": [
                      "endpoint"
                    ],
                    "properties": {
                      "endpoint": {}
                    }
                  },
                  {
                    "required": [
                      "authentication"
                    ],
                    "properties": {
                      "authentication": {}
                    }
                  },
                  {
                    "required": [
                      "localContract"
                    ],
                    "properties": {
                      "localContract": {}
                    }
                  }
                ]
              }
            }
          },
          {
            "if": {
              "required": [
                "method"
              ],
              "properties": {
                "method": {
                  "const": "envar"
                }
              }
            },
            "then": {
              "required": [
                "issuer",
                "environment"
              ],
              "properties": {
                "protocol": {
                  "const": "mpp"
                },
                "currency": {
                  "const": "cny"
                },
                "recipient": {
                  "type": "string",
                  "format": "uuid"
                },
                "issuer": {},
                "environment": {}
              }
            },
            "else": {
              "properties": {
                "cardUrl": {
                  "pattern": "^https://",
                  "type": "string"
                }
              },
              "not": {
                "anyOf": [
                  {
                    "required": [
                      "issuer"
                    ],
                    "properties": {
                      "issuer": {}
                    }
                  },
                  {
                    "required": [
                      "environment"
                    ],
                    "properties": {
                      "environment": {}
                    }
                  }
                ]
              }
            }
          }
        ]
      }
    },
    "budgets": {
      "type": "array",
      "minItems": 0,
      "items": {
        "type": "object",
        "additionalProperties": false,
        "required": [
          "currency",
          "maxTotal",
          "period"
        ],
        "properties": {
          "currency": {
            "type": "string",
            "minLength": 1
          },
          "maxTotal": {
            "$ref": "#/$defs/amount"
          },
          "period": {
            "const": "cumulative"
          }
        }
      }
    }
  },
  "$defs": {
    "amount": {
      "type": "string",
      "pattern": "^[1-9][0-9]{0,77}$"
    }
  }
}
