{
  "policyVersion":1,
  "paymentsEnabled":false,
  "approval":"per_purchase",
  "peers":[{
    "id":"research-seller",
    "cardUrl":"https://seller.example/services/research/v1/offers/usdc-once/agent-card.json",
    "protocol":"x402",
    "currency":"eip155:84532/erc20:0x036CbD53842c5426634e7929541eC2318f3dCF7e",
    "recipient":"0x2222222222222222222222222222222222222222",
    "maxPerPurchase":"3000000"
  }],
  "budgets":[{
    "currency":"eip155:84532/erc20:0x036CbD53842c5426634e7929541eC2318f3dCF7e",
    "maxTotal":"10000000",
    "period":"cumulative"
  }]
}
